{
  "schema_version": 1,
  "batch_id": "sentrux-diff-replay-batch",
  "cohort_id": "agent-loop-core",
  "repo_root": "<sentrux-root>",
  "repo_label": "sentrux",
  "expected_signal_kinds": [
    "closed_domain_exhaustiveness",
    "forbidden_raw_read",
    "missing_test_coverage",
    "large_file",
    "session_introduced_clone"
  ],
  "default_tags": ["calibration", "replay"],
  "rev_range": "HEAD~40..HEAD",
  "max_count": 12
}
